126,Blueberry,"B-D38 Sunburst 38 Inch Acoustic Guitar Kit Inbuilt Truss Rod with Bag, Strap, One Pack Strings And Picks","₹2,795",7 Days Replacement,"FREE delivery: Thursday, May 19 Details",In Stock,https://www.amazon.in/gp/slredirect/picassoRedirect.html/ref=pa_sp_atf_next_aps_sr_pg2_1?ie=UTF8&adId=A0049261ZB8H36TUAX2&url=%2FBlueberry-B-D38-Sunburst-Acoustic-Inbuilt%2Fdp%2FB08QZCK76B%2Fref%3Dsr_1_49_sspa%3Fkeywords%3Dguitar%26qid%3D1652621843%26sr%3D8-49-spons%26psc%3D1&qualifier=1652621843&id=7569169609036959&widgetName=sp_atf_next
127,Blueberry,"B40L, 40"" Acoustic Guitar Kit Inbuilt Truss Rod with Bag, Strap, One Pack Strings And Picks (Classic Maroon)","₹4,295",7 Days Replacement,"FREE delivery: Thursday, May 19 Details",In Stock,https://www.amazon.in/gp/slredirect/picassoRedirect.html/ref=pa_sp_atf_next_aps_sr_pg2_1?ie=UTF8&adId=A00514452JKYA7IP4JEAA&url=%2FBlueberry-Acoustic-Inbuilt-Strings-Classic%2Fdp%2FB09VLF8B8G%2Fref%3Dsr_1_50_sspa%3Fkeywords%3Dguitar%26qid%3D1652621843%26sr%3D8-50-spons%26psc%3D1&qualifier=1652621843&id=7569169609036959&widgetName=sp_atf_next
128,GUITAR,"BRO - COMBO (Black Acoustic Guitar for Beginner, Guitar Learning Kit, Song Book, Video Lectures, Accessories like Pick, Bag)","₹6,499",7 Days Replacement,FREE delivery: May 20 - 23,In Stock,https://www.amazon.in/gp/slredirect/picassoRedirect.html/ref=pa_sp_atf_next_aps_sr_pg2_1?ie=UTF8&adId=A087933837LQ4BBEWM3H5&url=%2FGUITAR-BRO-Acoustic-Beginner-Accessories%2Fdp%2FB07T84GC8L%2Fref%3Dsr_1_51_sspa%3Fkeywords%3Dguitar%26qid%3D1652621843%26sr%3D8-51-spons%26psc%3D1&qualifier=1652621843&id=7569169609036959&widgetName=sp_atf_next
129,Kadence,"Guitar Acoustica Series, 41” Jumbo Size 6-strings Acoustic Guitar, Spruce body with Pick Guard A311 with bag","₹7,499.00",7 Days Replacement,"FREE delivery: Friday, May 20 Details",In Stock,https://www.amazon.in/gp/slredirect/picassoRedirect.html/ref=pa_sp_atf_next_aps_sr_pg2_1?ie=UTF8&adId=A02055132SF64AM9MYQQ8&url=%2FKadence-6-strings-Acoustic-Guitar-Natural%2Fdp%2FB07JKYWGJN%2Fref%3Dsr_1_52_sspa%3Fkeywords%3Dguitar%26qid%3D1652621843%26sr%3D8-52-spons%26psc%3D1%26smid%3DAM04Z7MH4HSDD&qualifier=1652621843&id=7569169609036959&widgetName=sp_atf_next
130,Blueberry,"38C, 38"" Acoustic Guitar Kit with Bag, Strap, One Pack Strings And Picks (Black)","₹2,695",7 Days Replacement,"FREE delivery: Thursday, May 19 Details",In Stock,https://www.amazon.in/Blueberry-38C-Acoustic-Guitar-Strings/dp/B08KLMV4XX/ref=sr_1_53?keywords=guitar&qid=1652621843&sr=8-53
131,Martin,Smith W-101-N-PK Acoustic Guitar Super Kit with Stand (Natural),"₹5,984",7 Days Replacement,"FREE delivery: Saturday, May 21 Details",In Stock,https://www.amazon.in/Martin-Smith-W-101-N-PK-Acoustic-Natural/dp/B00UOUK4IE/ref=sr_1_54?keywords=guitar&qid=1652621843&sr=8-54
132,Kadence,"AstroMan Electric Guitar, 21 FRETS, ROSEWOOD FRETBOARD, H - S - S PICK UPS Sunburst combo with Bag, Guitar strap,guitar cable and Picks","₹6,999",7 Days Replacement,"FREE delivery: Thursday, May 19 Details",In Stock,https://www.amazon.in/Kadence-Electric-Guitar-Rosewood-Fretboard/dp/B07BGXN7P6/ref=sr_1_55?keywords=guitar&qid=1652621843&sr=8-55
133,Yamaha,"F310 Acoustic Guitar, Natural","₹9,450",7 Days Replacement,FREE delivery: May 24 - 28 Details,In Stock,https://www.amazon.in/Yamaha-F310-Acoustic-Guitar-Natural/dp/B08Z3C1GRM/ref=sr_1_56?keywords=guitar&qid=1652621843&sr=8-56
134,Kadence,"Guitar Acoustica Series, 41” Jumbo Size 6-strings Acoustic Guitar, Spruce body with Pick Guard A311 with bag","₹7,499.00",7 Days Replacement,"FREE delivery: Friday, May 20 Details",In Stock,https://www.amazon.in/Kadence-6-strings-Acoustic-Guitar-Natural/dp/B07JKYWGJN/ref=sr_1_57?keywords=guitar&qid=1652621843&sr=8-57
135,Martin,Smith W-101-Bl-PK Acoustic Guitar Super Kit with Stand (Blue),"₹5,958",7 Days Replacement,"FREE delivery: Saturday, May 21 Details",In Stock,https://www.amazon.in/Martin-Smith-W-101-Bl-PK-Acoustic-Guitar/dp/B01EUWC4Y8/ref=sr_1_58?keywords=guitar&qid=1652621843&sr=8-58
136,Givson,"Ketostics Venus Special VS-BLK, Acoustic Guitar Combo with Cover/Bag, String Set, Belt and Picks","₹4,199",7 Days Replacement,"FREE delivery: Thursday, May 19 Details",In Stock,https://www.amazon.in/GIVSON-KETOSTICS-VS-BLK-Strings-Acoustic/dp/B07R9ZLSNL/ref=sr_1_59?keywords=guitar&qid=1652621843&sr=8-59
137,Belear,"K-610SSBM Vega Series 41 Inch Satin Sunburst Spruce Dreadnought Acoustic Guitar with Truss Rod Combo with Gig Bag and Picks, full","₹4,698",7 Days Replacement,"FREE delivery: Saturday, May 21 Details",In Stock,https://www.amazon.in/Belear-K-610SSBM-Sunburst-Dreadnought-Acoustic/dp/B09139GC7M/ref=sr_1_60?keywords=guitar&qid=1652621843&sr=8-60
138,Intern,INT-38C Sunburst Acoustic Guitar kit with carry bag & picks,"₹2,090",7 Days Replacement,"FREE delivery: Saturday, May 21 Details",In Stock,https://www.amazon.in/Intern-INT-38C-Sunburst-Acoustic-Guitar/dp/B07X1J4D3Z/ref=sr_1_61?keywords=guitar&qid=1652621843&sr=8-61
139,Blueberry,"38C, 38"" Acoustic Guitar Kit with Bag, Strap, One Pack Strings And Picks (Sunburst)","₹2,695",7 Days Replacement,"FREE delivery: Thursday, May 19 Details",In Stock,https://www.amazon.in/Blueberry-38C-Acoustic-Strings-Sunburst/dp/B08KLMQN88/ref=sr_1_62?keywords=guitar&qid=1652621843&sr=8-62
140,Juarez,"Acoustic Guitar, 38 Inch Cutaway, 38CMB with Bag, Strings, Pick and Strap, Matte Black","₹3,097",7 Days Replacement,"FREE delivery: Saturday, May 21 Details",In Stock,https://www.amazon.in/Juarez-Acoustic-Guitar-Cutaway-Strings/dp/B084VRCCN7/ref=sr_1_63?keywords=guitar&qid=1652621843&sr=8-63
141,Givson,"Venus Special Cutaway Rosewood 41 Inch Acoustic Guitar Kit with Bag, Rhythm String Set, Strap and 5 Plectrums, (Red)","₹3,799",7 Days Replacement,"FREE delivery: Thursday, May 19 Details",In Stock,https://www.amazon.in/Givson-Ketostics-VS-RED-Acoustic-Plectrums/dp/B08KS2N1H9/ref=sr_1_64?keywords=guitar&qid=1652621843&sr=8-64
142,Hovner,"Carlton Orange 6-String Right Hand Acoustic Semi-Electric Guitar,special Quality Rosewood Fretboard with Bag and free 1 Set String, 2 Picks.","₹4,149",7 Days Replacement,"FREE delivery: Friday, May 20 Details",In Stock,https://www.amazon.in/6-String-Acoustic-Semi-Electric-Rosewood-Fretboard/dp/B08ZN1CKKT/ref=sr_1_65?keywords=guitar&qid=1652621843&sr=8-65
143,Yamaha,Classical Guitar C40//02,"₹7,590",7 Days Replacement,₹700.00 delivery: May 31 - June 2 Details,In Stock,https://www.amazon.in/Yamaha-Classical-Guitar-C40-02/dp/B003UGCUFE/ref=sr_1_66?keywords=guitar&qid=1652621843&sr=8-66
144,Ketostics,"Givson Venus Special Cutaway Rosewood 41 Inch Acoustic Guitar Kit with Bag, Rhythm String Set, Strap and 5 Plectrums, (sunbrust)","₹3,999",7 Days Replacement,"FREE delivery: Thursday, May 19 Details",In Stock,https://www.amazon.in/Ketostics-Rosewood-Acoustic-Plectrums-sunbrust/dp/B09NSXMVF4/ref=sr_1_67?keywords=guitar&qid=1652621843&sr=8-67
145,Fender,"FA125CE Electric Acoustic Guitar With Sponge Bag, Belt, String Set, & Plectrums Combo Pack","₹19,499",7 Days Replacement,"FREE delivery: Saturday, May 21 Details",In Stock,https://www.amazon.in/Fender-FA125CE-Electric-Acoustic-Plectrums/dp/B08MQB1VV5/ref=sr_1_68?keywords=guitar&qid=1652621843&sr=8-68
146,Blueberry,"B-40EQ-GL Acoustic Electric Guitar Kit inbuilt Trussrod, Rosewood Fretboard & bridge with 4 Band EQ-7545R Piezo Pickup Guitar Preamp Amplifier Equalizer Tuner with Bag, Pick, Belt, String set","₹4,999",7 Days Replacement,"FREE delivery: Thursday, May 19 Details",In Stock,https://www.amazon.in/gp/slredirect/picassoRedirect.html/ref=pa_sp_mtf_aps_sr_pg2_1?ie=UTF8&adId=A0050053YFBD0RZWXSXR&url=%2FBlueberry-B-40EQ-GL-Fretboard-Amplifier-Equalizer%2Fdp%2FB09MZ5C9TL%2Fref%3Dsr_1_69_sspa%3Fkeywords%3Dguitar%26qid%3D1652621843%26sr%3D8-69-spons%26psc%3D1&qualifier=1652621843&id=7569169609036959&widgetName=sp_mtf
147,Gibz's,G-38 Glossy Acoustic Guitar With Truss Rod Natural,"₹3,490",7 Days Replacement,"FREE delivery: Thursday, May 19 Details",In Stock,https://www.amazon.in/gp/slredirect/picassoRedirect.html/ref=pa_sp_mtf_aps_sr_pg2_1?ie=UTF8&adId=A042850030V4VIM4NLGYG&url=%2FGibzs-38-C-Acoustic-Guitar-Natural%2Fdp%2FB07M8KBTX8%2Fref%3Dsr_1_70_sspa%3Fkeywords%3Dguitar%26qid%3D1652621843%26sr%3D8-70-spons%26psc%3D1&qualifier=1652621843&id=7569169609036959&widgetName=sp_mtf
148,Blueberry,"B-G41S, 41 Inch Acoustic Guitar Kit, with Bag,Belt, One Pack Strings And Picks (Natural)","₹6,500",7 Days Replacement,"FREE delivery: Thursday, May 19 Details",In Stock,https://www.amazon.in/gp/slredirect/picassoRedirect.html/ref=pa_sp_mtf_aps_sr_pg2_1?ie=UTF8&adId=A00502093JZAPX140CZG0&url=%2FBlueberry-B-G41S-Acoustic-Strings-Natural%2Fdp%2FB07PKQGF2N%2Fref%3Dsr_1_71_sspa%3Fkeywords%3Dguitar%26qid%3D1652621843%26sr%3D8-71-spons%26psc%3D1&qualifier=1652621843&id=7569169609036959&widgetName=sp_mtf
149,Blueberry,"B-40, 40"" Acoustic Guitar Kit with Bag,Belt, One Pack Strings & Picks (Sunburst)","₹3,695",7 Days Replacement,"FREE delivery: Thursday, May 19 Details",In Stock,https://www.amazon.in/gp/slredirect/picassoRedirect.html/ref=pa_sp_mtf_aps_sr_pg2_1?ie=UTF8&adId=A00497171W5X8ZPSW04BM&url=%2FBlueberry-Acoustic-Guitar-Strings-Sunburst%2Fdp%2FB08L7XJQQ1%2Fref%3Dsr_1_72_sspa%3Fkeywords%3Dguitar%26qid%3D1652621843%26sr%3D8-72-spons%26psc%3D1&qualifier=1652621843&id=7569169609036959&widgetName=sp_mtf
150,JUAREZ,"Fiésta 41 Inch Acoustic Guitar Cutaway with Dual Action Truss Rod, 21 Frets Rosewood Fretboard & Bridge, Padded 5mm Cotton Bag, Cotton Strap, 2 Picks, Allen Key, Extra String Set, 3TS Sunburst","₹4,211",7 Days Replacement,"FREE delivery: Thursday, May 19 Details",In Stock,https://www.amazon.in/JUAREZ-Acoustic-Rosewood-Fretboard-3TS/dp/B08GZXNSBG/ref=sr_1_73?keywords=guitar&qid=1652621843&sr=8-73
151,Yamaha,"PACIFICA012 Electric Guitar, Red Metallic","₹13,900",7 Days Replacement,"FREE delivery: Saturday, May 21 Details",In Stock,https://www.amazon.in/Yamaha-PAC012-Electric-Guitar-Metallic/dp/B000MLY7XS/ref=sr_1_74?keywords=guitar&qid=1652621843&sr=8-74
152,Ketostics™,"Venus Special Cutaway Rosewood 41 Inch Givson Acoustic Guitar Kit with Bag, Rhythm String Set, Strap and 5 Plectrums, (sunburst)","₹3,799",7 Days Replacement,"FREE delivery: Thursday, May 19 Details",In Stock,https://www.amazon.in/Ketostics-Special-Sunburst-Acoustic-Plectrums/dp/B08JCJS3H6/ref=sr_1_75?keywords=guitar&qid=1652621843&sr=8-75
153,Ibanez,"MD39C-NT Acoustic Guitar (Natural), Designed in Japan and Made Specially for India","₹6,999",7 Days Replacement,"FREE delivery: Saturday, May 21 Details",In Stock,https://www.amazon.in/Ibanez-IBA-MD39CNT-Acoustic-Guitar-MD39C-NT/dp/B07G4CCMYL/ref=sr_1_76?keywords=guitar&qid=1652621843&sr=8-76
154,Kadence,"Frontier Jumbo Semi Acoustic Guitar With Die Cast Keys,Super Combo (Bag, 1 pack Strings, Strap, Picks, Capo, Tuner)","₹7,349.00",7 Days Replacement,"FREE delivery: Friday, May 20 Details",In Stock,https://www.amazon.in/Kadence-Frontier-Acoustic-Guitar-Equalizer/dp/B01HRIHJWY/ref=sr_1_77?keywords=guitar&qid=1652621843&sr=8-77
155,Blueberry,"D38 TrussRod Acoustic Guitar Kit with Bag, String,Belt & Picks (Sunburst)","₹2,895",7 Days Replacement,"FREE delivery: Thursday, May 19 Details",In Stock,https://www.amazon.in/Blueberry-Trussrod-Acoustic-Guitar-Sunburst/dp/B08WH5553T/ref=sr_1_78?keywords=guitar&qid=1652621843&sr=8-78
156,Blueberry,"B-D38, 38 Inch Acoustic Guitar Kit Inbuilt Truss Rod with Bag, Strap, One Pack Strings And Picks (Sunburst)","₹2,795",7 Days Replacement,"FREE delivery: Thursday, May 19 Details",In Stock,https://www.amazon.in/Blueberry-B-D38-Acoustic-Inbuilt-Sunburst/dp/B08LNP8KGS/ref=sr_1_79?keywords=guitar&qid=1652621843&sr=8-79
157,JUAREZ,"Arpeggio 39 Inch Acoustic Guitar Kit, Spruce Top, Rosewood Fretboard & Bridge, Truss Rod, Chrome Die Cast Machine Tuners, Sunburst","₹6,315",7 Days Replacement,"FREE delivery: Saturday, May 21 Details",In Stock,https://www.amazon.in/JUAREZ-Arpeggio-Acoustic-Rosewood-Fretboard/dp/B08LBHN8ZR/ref=sr_1_80?keywords=guitar&qid=1652621843&sr=8-80
158,Givson,Oxford Natural 6 String Right Hand Acoustic Semi Electric Guitar Special Quality Rosewood Fretboard With Free Bag and 1 Set String and 2 Picks,"₹4,249",7 Days Replacement,"FREE delivery: Saturday, May 21 Details",In Stock,https://www.amazon.in/Natural-Acoustic-Electric-Rosewood-Fretboard/dp/B09R2G69BV/ref=sr_1_81?keywords=guitar&qid=1652621843&sr=8-81
159,Kordz,"Luana Black Matt Rosewood Fretboard Acoustic Guitar With Bag,Strap,1 Set of Extra Strings and 2 Picks","₹3,600",7 Days Replacement,"FREE delivery: Friday, May 20 Details",In Stock,https://www.amazon.in/Kordz-Rosewood-Fretboard-Acoustic-Strings/dp/B09S13CW14/ref=sr_1_82?keywords=guitar&qid=1652621843&sr=8-82
160,Ibanez,"Acoustic Guitar MD39C Right Handed Cutaway Guitar - Natural With Bag, Belt, Plectrums Complete Pack.","₹8,999",7 Days Replacement,"FREE delivery: Saturday, May 21 Details",In Stock,https://www.amazon.in/Ibanez-Acoustic-Guitar-Handed-Cutaway/dp/B08FMW6WJM/ref=sr_1_83?keywords=guitar&qid=1652621843&sr=8-83
161,Givson,"Venus Special Cutaway Rosewood 41 Inch Acoustic Guitar Kit with Bag, Rhythm String Set, Strap and 5 Plectrums, (red)","₹3,999",7 Days Replacement,"FREE delivery: Thursday, May 19 Details",In Stock,https://www.amazon.in/Special-Cutaway-Rosewood-Acoustic-Plectrums/dp/B09P41Y4HZ/ref=sr_1_84?keywords=guitar&qid=1652621843&sr=8-84
162,Yamaha,"F280 Acoustic Guitar, Tobacco Brown Sunburst with Bajaao Gig bag","₹8,299",7 Days Replacement,"FREE delivery: Saturday, May 21 Details",In Stock,https://www.amazon.in/Yamaha-Acoustic-Tobacco-Sunburst-Bajaao/dp/B09PBDGD82/ref=sr_1_85?keywords=guitar&qid=1652621843&sr=8-85
163,Juârez,"Acoustic Guitar, 38 Inch Cutaway, JRZ38CT, Hippie Funky Design, with Bag, Picks, Strap & Extra String set","₹7,990",7 Days Replacement,"FREE delivery: Saturday, May 21 Details",In Stock,https://www.amazon.in/Juarez-Acoustic-Guitar-Cutaway-JRZ38CT/dp/B01N3TTYJQ/ref=sr_1_86?keywords=guitar&qid=1652621843&sr=8-86
164,Kadence,"Professional Kids Guitar 5-10 Years Natural with Bag, Strap, Strings and Picks","₹3,799",7 Days Replacement,"FREE delivery: Saturday, May 21 Details",In Stock,https://www.amazon.in/Kadence-Professional-Guitar-Natural-Strings/dp/B094ZWXHV4/ref=sr_1_87?keywords=guitar&qid=1652621843&sr=8-87
165,Kadence,"Frontier 34inch guitar for Kids, Travel Guitar for Adult Acoustic Guitar with Die Cast Keys, Set of Strings, Strap, Picks and Bag (Black Guitar)","₹3,499",7 Days Replacement,"FREE delivery: Saturday, May 21 Details",In Stock,https://www.amazon.in/Kadence-Professional-Guitar-Years-Strings/dp/B07YZK5B2Z/ref=sr_1_88?keywords=guitar&qid=1652621843&sr=8-88
166,Kadence,"39” Classical Guitar Nylon Strings Acoustic Guitar with Truss Rod for Beginner Professional With Bag (30"" 1/4 Semi Acoustic GLE03)","₹3,999.00",7 Days Replacement,"FREE delivery: Saturday, May 21 Details",In Stock,https://www.amazon.in/Kadence-Classical-Acoustic-Beginner-Professional/dp/B09V2R4CQT/ref=sr_1_89?keywords=guitar&qid=1652621843&sr=8-89
167,Kadence,"Frontier Series Acoustic Guitar With Equalizer and Pickup,Die Cast Keys Sunburst","₹5,799",7 Days Replacement,"FREE delivery: Saturday, May 21 Details",In Stock,https://www.amazon.in/Kadence-Frontier-Acoustic-Equlizer-Sunburst/dp/B07DQNS5XR/ref=sr_1_90?keywords=guitar&qid=1652621843&sr=8-90
168,Intern,INT-38C Natural Acoustic Guitar kit with carry bag & picks,"₹2,090",7 Days Replacement,"FREE delivery: Saturday, May 21 Details",In Stock,https://www.amazon.in/Intern-INT-38C-Natural-Acoustic-Guitar/dp/B07X4LPJ6H/ref=sr_1_91?keywords=guitar&qid=1652621843&sr=8-91
169,RockJam,RJEG02-SK-BB Electric Guitar Starter Kit (Blue Burst),"₹8,630",7 Days Replacement,"FREE delivery: Saturday, May 21 Details",In Stock,https://www.amazon.in/RockJam-RJEG02-SK-BB-Electric-Guitar-Starter/dp/B0747TD557/ref=sr_1_92?keywords=guitar&qid=1652621843&sr=8-92
170,GIVSON,"Ketostics Venus Special Guitar (black) with bag, string set, belt and 5 picks","₹4,199",7 Days Replacement,"FREE delivery: Thursday, May 19 Details",In Stock,https://www.amazon.in/Givson-Special-Guitar-VS-BLK-Acoustic/dp/B07SZ5KR61/ref=sr_1_93?keywords=guitar&qid=1652621843&sr=8-93
171,Kadence,"AstroMan Electric Guitar, 21 FRETS, ROSEWOOD FRETBOARD, H - S - S PICK UPS Sun brust combo with Bag, Guitar strap,guitar cable and Picks with Amplifier","₹8,999.00",7 Days Replacement,FREE delivery: May 17 - 21 Details,In Stock,https://www.amazon.in/Kadence-AstroMan-Electric-ROSEWOOD-FRETBOARD/dp/B09YHPS66K/ref=sr_1_94?keywords=guitar&qid=1652621843&sr=8-94
172,INTERN,"40 inches Acoustic Guitar with Pick-up & truss rod, carry bag, strings pack, strap & picks. Premium Wooden durable built, Best tonal stability with professional sound amplificaiton. (White).","₹8,995",7 Days Replacement,"FREE delivery: Saturday, May 21 Details",In Stock,https://www.amazon.in/Acoustic-Pick-up-stability-professional-amplificaiton/dp/B09YH7WJP3/ref=sr_1_95?keywords=guitar&qid=1652621843&sr=8-95
173,Fender,CD 60 Dread V3 DS 6 String Acoustic Guitar - Walnut Fretboard-Black,"₹12,600",7 Days Replacement,"FREE delivery: Sunday, May 22 Details",In Stock,https://www.amazon.in/Fender-Dread-String-Acoustic-Guitar/dp/B07RM4B5LJ/ref=sr_1_96?keywords=guitar&qid=1652621843&sr=8-96
174,Medellin,MED-BLU-C Linden Wood Acoustic Guitar,"₹2,599",7 Days Replacement,"FREE delivery: Saturday, May 21 Details",In Stock,https://www.amazon.in/Jixing-Strings-Acoustic-Guitars-Black/dp/B00V5ZCVQA/ref=sr_1_97?keywords=guitar&qid=1652621843&sr=8-97
175,Yamaha,FSX80C Semi Acoustic Cutaway Guitar with Bag (Natural),"₹12,980",7 Days Replacement,FREE delivery: May 17 - 19 Details,In Stock,https://www.amazon.in/Yamaha-FSX80C-Acoustic-Cutaway-Natural/dp/B09HL3GFZF/ref=sr_1_98?keywords=guitar&qid=1652621843&sr=8-98
176,Juârez,"Acoustic Guitar, 38 Inch Cutaway, JRZ38C with Bag, Strings, Pick and Strap, Red","₹2,649",7 Days Replacement,"FREE delivery: Saturday, May 21 Details",In Stock,https://www.amazon.in/JUAREZ-JRZ38C-Handed-Acoustic-Strings/dp/B01FYYTDW2/ref=sr_1_99?keywords=guitar&qid=1652621843&sr=8-99
177,Yamaha,FX280 Semi acoustic Dreadnought Guitar with Bag (Natural),"₹11,300",7 Days Replacement,"FREE delivery: Sunday, May 22 Details",In Stock,https://www.amazon.in/Yamaha-FX280-acoustic-Dreadnought-Natural/dp/B09HR6BNFQ/ref=sr_1_100?keywords=guitar&qid=1652621843&sr=8-100
178,Kadence,"A311, 36"" 6-strings Acoustic Guitar with bag","₹5,248",7 Days Replacement,"FREE delivery: Saturday, May 21 Details",In Stock,https://www.amazon.in/Kadence-A311-6-strings-Acoustic-Guitar/dp/B09BN1MN2T/ref=sr_1_101?keywords=guitar&qid=1652621843&sr=8-101
179,Kadence,"Guitar Frontier Series, Blue Acoustic Guitar with Die Cast Keys, Set of Strings, Strap, Picks, Guitar stand, Capo and Bag, Super Combo (Blue, Acoustic)","₹5,499.00",7 Days Replacement,"FREE delivery: Friday, May 20 Details",In Stock,https://www.amazon.in/Kadence-Frontier-Acoustic-Foldable-Strings/dp/B01CJJGEVS/ref=sr_1_102?keywords=guitar&qid=1652621843&sr=8-102
180,Yamaha,"Electric-Acoustic Guitar FSX80C Dreadnought With With Mexa Sponge Bag, Guitar Belt, Guitar Stand, String Set & Plectrums.(NT)","₹13,539",7 Days Replacement,"FREE delivery: Saturday, May 21 Details",In Stock,https://www.amazon.in/Yamaha-Electric-Acoustic-FSX80C-Dreadnought-Plectrums/dp/B09HSJ6GPQ/ref=sr_1_103?keywords=guitar&qid=1652621843&sr=8-103
181,Kadence,"39” Classical Guitar Nylon Strings Acoustic Guitar with Truss Rod for Beginner Professional With Bag (30"" 1/4 Semi Acoustic Gl101R)","₹6,999.00",7 Days Replacement,"FREE delivery: Saturday, May 21 Details",In Stock,https://www.amazon.in/Kadence-Classical-Acoustic-Beginner-Professional/dp/B09V2SPSDX/ref=sr_1_104?keywords=guitar&qid=1652621843&sr=8-104
182,Kadence,"Frontier guitar with Online Guitar learning course, Wine Red Acoustic Guitar with Die Cast Keys, Set of Strings, Strap, Picks and Bag (Wine Red, Acoustic)","₹5,399.00",7 Days Replacement,"FREE delivery: Friday, May 20 Details",In Stock,https://www.amazon.in/gp/slredirect/picassoRedirect.html/ref=pa_sp_atf_aps_sr_pg1_1?ie=UTF8&adId=A061107531TUGN5RHMV0N&url=%2FKadence-Frontier-Acoustic-Guitar-Strings%2Fdp%2FB01GDZ46AA%2Fref%3Dsr_1_1_sspa%3Fkeywords%3Dguitar%26qid%3D1652621550%26smid%3DAM04Z7MH4HSDD%26sr%3D8-1-spons%26psc%3D1%26smid%3DAM04Z7MH4HSDD&qualifier=1652621550&id=1831618335065109&widgetName=sp_atf
183,Kadence,"Frontier Jumbo Semi Acoustic Guitar With Die Cast Keys Super Combo (Bag, 1 pack Strings, Strap, Picks, Capo, Tuner (natural)","₹7,348.00",7 Days Replacement,"FREE delivery: Saturday, May 21 Details",In Stock,https://www.amazon.in/gp/slredirect/picassoRedirect.html/ref=pa_sp_atf_aps_sr_pg1_1?ie=UTF8&adId=A0046612372SWJAK5T57D&url=%2FKadence-Frontier-Acoustic-Equalizer-Strings%2Fdp%2FB01HRIHH9E%2Fref%3Dsr_1_2_sspa%3Fkeywords%3Dguitar%26qid%3D1652621550%26sr%3D8-2-spons%26psc%3D1&qualifier=1652621550&id=1831618335065109&widgetName=sp_atf
184,Vault,"Traveller 34 Inch Acoustic Guitar With Bag, Strap, Strings, Polishing Cloth, String Winder and Picks - Natural Gloss","₹3,799",7 Days Replacement,"FREE delivery: Friday, May 20 Details",In Stock,https://www.amazon.in/gp/slredirect/picassoRedirect.html/ref=pa_sp_atf_aps_sr_pg1_1?ie=UTF8&adId=A0745490374VP9DX2TU09&url=%2FTraveller-Acoustic-Guitar-Strings-Polishing%2Fdp%2FB07RK9962M%2Fref%3Dsr_1_3_sspa%3Fkeywords%3Dguitar%26qid%3D1652621550%26sr%3D8-3-spons%26psc%3D1&qualifier=1652621550&id=1831618335065109&widgetName=sp_atf
185,Blueberry,"38C, 38"" Acoustic Guitar Kit with Bag, Strap, One Pack Strings And Picks (Black)","₹2,695",7 Days Replacement,"FREE delivery: Thursday, May 19 Details",In Stock,https://www.amazon.in/gp/slredirect/picassoRedirect.html/ref=pa_sp_atf_aps_sr_pg1_1?ie=UTF8&adId=A0049561XBD14Z9O6GXG&url=%2FBlueberry-38C-Acoustic-Guitar-Strings%2Fdp%2FB08KLMV4XX%2Fref%3Dsr_1_4_sspa%3Fkeywords%3Dguitar%26qid%3D1652621550%26sr%3D8-4-spons%26psc%3D1&qualifier=1652621550&id=1831618335065109&widgetName=sp_atf
186,Intern,"INT-38C Acoustic Guitar Kit, With Bag, Strings, Pick And Strap, Black","₹2,150",7 Days Replacement,"FREE delivery: Saturday, May 21 Details",In Stock,https://www.amazon.in/Intern-INT-38C-Acoustic-Guitar-Black/dp/B073B6TQQY/ref=sr_1_5?keywords=guitar&qid=1652621550&sr=8-5
187,Juarez,"Acoustic Guitar, 38 Inch Curved Body Cutaway, 38CUR with Bag, Strings, Pick and Strap, Black","₹2,850",7 Days Replacement,"FREE delivery: Saturday, May 21 Details",In Stock,https://www.amazon.in/Juarez-Acoustic-Guitar-Cutaway-Strings/dp/B076QHZ4HZ/ref=sr_1_omk_6?keywords=guitar&qid=1652621550&sr=8-6
188,Medellin,"38"" Acoustic Guitar Carbon Fiber body+(Free Online Learning Course) - Durable Matt finish with handrest, strings, strap, bag, 3 Picks, capo, stand.","₹1,899",7 Days Replacement,"FREE delivery: Saturday, May 21 Details",In Stock,https://www.amazon.in/Medellin-Acoustic-Guitar-Carbon-Learning/dp/B09MSFP7JK/ref=sr_1_7?keywords=guitar&qid=1652621550&sr=8-7
189,Intern,"INT-38C Acoustic Guitar Kit, With Bag, Strings, Pick And Strap, Black","₹2,150",7 Days Replacement,"FREE delivery: Saturday, May 21 Details",In Stock,https://www.amazon.in/Intern-INT-38C-Acoustic-Guitar-Black/dp/B073B6TQQY/ref=sxin_14?asc_contentid=amzn1.osa.1320a493-71c5-4ff9-a1fa-1353eba85472.A21TJRUUN4KGV.en_IN&asc_contenttype=article&ascsubtag=amzn1.osa.1320a493-71c5-4ff9-a1fa-1353eba85472.A21TJRUUN4KGV.en_IN&creativeASIN=B073B6TQQY&cv_ct_cx=guitar&cv_ct_id=amzn1.osa.1320a493-71c5-4ff9-a1fa-1353eba85472.A21TJRUUN4KGV.en_IN&cv_ct_pg=search&cv_ct_we=asin&cv_ct_wn=osp-single-source-earns-comm&keywords=guitar&linkCode=oas&pd_rd_i=B073B6TQQY&pd_rd_r=ca3dd11c-878e-4c1c-a24c-47c6fb5e3042&pd_rd_w=pF4Bu&pd_rd_wg=FpPBl&pf_rd_p=f50b8836-bf86-46c0-a999-ee1dda2b7d1f&pf_rd_r=T9C1ZVFSPSZX2632QWFG&qid=1652621550&sr=1-1-61f4c597-7a45-4a97-bd75-c52903f8ee93&tag=hznew-21
190,Kadence,"Frontier guitar with Online Guitar learning course, Wine Red Acoustic Guitar with Die Cast Keys, Set of Strings, Strap, Picks and Bag (Wine Red, Acoustic)","₹5,399.00",7 Days Replacement,"FREE delivery: Friday, May 20 Details",In Stock,https://www.amazon.in/Kadence-Frontier-Acoustic-Guitar-Strings/dp/B01GDZ46AA/ref=sxin_14?asc_contentid=amzn1.osa.1320a493-71c5-4ff9-a1fa-1353eba85472.A21TJRUUN4KGV.en_IN&asc_contenttype=article&ascsubtag=amzn1.osa.1320a493-71c5-4ff9-a1fa-1353eba85472.A21TJRUUN4KGV.en_IN&creativeASIN=B01GDZ46AA&cv_ct_cx=guitar&cv_ct_id=amzn1.osa.1320a493-71c5-4ff9-a1fa-1353eba85472.A21TJRUUN4KGV.en_IN&cv_ct_pg=search&cv_ct_we=asin&cv_ct_wn=osp-single-source-earns-comm&keywords=guitar&linkCode=oas&pd_rd_i=B01GDZ46AA&pd_rd_r=ca3dd11c-878e-4c1c-a24c-47c6fb5e3042&pd_rd_w=pF4Bu&pd_rd_wg=FpPBl&pf_rd_p=f50b8836-bf86-46c0-a999-ee1dda2b7d1f&pf_rd_r=T9C1ZVFSPSZX2632QWFG&qid=1652621550&smid=AM04Z7MH4HSDD&sr=1-2-61f4c597-7a45-4a97-bd75-c52903f8ee93&tag=hznew-21
191,Juarez,"Acoustic Guitar Kit, 38 Inch Cutaway, 38C with Bag, Strings, Pick and Strap, TBS Transparent Blue Sunburst","₹2,648",7 Days Replacement,"FREE delivery: Saturday, May 21 Details",In Stock,https://www.amazon.in/JUAREZ-JRZ38C-Acoustic-Sunburst-Strings/dp/B01FYYTDS6/ref=sxin_14?asc_contentid=amzn1.osa.1320a493-71c5-4ff9-a1fa-1353eba85472.A21TJRUUN4KGV.en_IN&asc_contenttype=article&ascsubtag=amzn1.osa.1320a493-71c5-4ff9-a1fa-1353eba85472.A21TJRUUN4KGV.en_IN&creativeASIN=B01FYYTDS6&cv_ct_cx=guitar&cv_ct_id=amzn1.osa.1320a493-71c5-4ff9-a1fa-1353eba85472.A21TJRUUN4KGV.en_IN&cv_ct_pg=search&cv_ct_we=asin&cv_ct_wn=osp-single-source-earns-comm&keywords=guitar&linkCode=oas&pd_rd_i=B01FYYTDS6&pd_rd_r=ca3dd11c-878e-4c1c-a24c-47c6fb5e3042&pd_rd_w=pF4Bu&pd_rd_wg=FpPBl&pf_rd_p=f50b8836-bf86-46c0-a999-ee1dda2b7d1f&pf_rd_r=T9C1ZVFSPSZX2632QWFG&qid=1652621550&sr=1-3-61f4c597-7a45-4a97-bd75-c52903f8ee93&tag=hznew-21
