261,Hovner,"Carlton Orange 6-String Right Hand Acoustic Semi-Electric Guitar,special Quality Rosewood Fretboard with Bag and free 1 Set String, 2 Picks.","₹4,149",7 Days Replacement,"FREE delivery: Friday, May 20 Details",In Stock,https://www.amazon.in/6-String-Acoustic-Semi-Electric-Rosewood-Fretboard/dp/B08ZN1CKKT/ref=sr_1_65?keywords=guitar&qid=1652621843&sr=8-65
262,Yamaha,Classical Guitar C40//02,"₹7,590",7 Days Replacement,₹700.00 delivery: May 31 - June 2 Details,In Stock,https://www.amazon.in/Yamaha-Classical-Guitar-C40-02/dp/B003UGCUFE/ref=sr_1_66?keywords=guitar&qid=1652621843&sr=8-66
263,Ketostics,"Givson Venus Special Cutaway Rosewood 41 Inch Acoustic Guitar Kit with Bag, Rhythm String Set, Strap and 5 Plectrums, (sunbrust)","₹3,999",7 Days Replacement,"FREE delivery: Thursday, May 19 Details",In Stock,https://www.amazon.in/Ketostics-Rosewood-Acoustic-Plectrums-sunbrust/dp/B09NSXMVF4/ref=sr_1_67?keywords=guitar&qid=1652621843&sr=8-67
264,Fender,"FA125CE Electric Acoustic Guitar With Sponge Bag, Belt, String Set, & Plectrums Combo Pack","₹19,499",7 Days Replacement,"FREE delivery: Saturday, May 21 Details",In Stock,https://www.amazon.in/Fender-FA125CE-Electric-Acoustic-Plectrums/dp/B08MQB1VV5/ref=sr_1_68?keywords=guitar&qid=1652621843&sr=8-68
265,Blueberry,"B-40EQ-GL Acoustic Electric Guitar Kit inbuilt Trussrod, Rosewood Fretboard & bridge with 4 Band EQ-7545R Piezo Pickup Guitar Preamp Amplifier Equalizer Tuner with Bag, Pick, Belt, String set","₹4,999",7 Days Replacement,"FREE delivery: Thursday, May 19 Details",In Stock,https://www.amazon.in/gp/slredirect/picassoRedirect.html/ref=pa_sp_mtf_aps_sr_pg2_1?ie=UTF8&adId=A0050053YFBD0RZWXSXR&url=%2FBlueberry-B-40EQ-GL-Fretboard-Amplifier-Equalizer%2Fdp%2FB09MZ5C9TL%2Fref%3Dsr_1_69_sspa%3Fkeywords%3Dguitar%26qid%3D1652621843%26sr%3D8-69-spons%26psc%3D1&qualifier=1652621843&id=7569169609036959&widgetName=sp_mtf
266,Gibz's,G-38 Glossy Acoustic Guitar With Truss Rod Natural,"₹3,490",7 Days Replacement,"FREE delivery: Thursday, May 19 Details",In Stock,https://www.amazon.in/gp/slredirect/picassoRedirect.html/ref=pa_sp_mtf_aps_sr_pg2_1?ie=UTF8&adId=A042850030V4VIM4NLGYG&url=%2FGibzs-38-C-Acoustic-Guitar-Natural%2Fdp%2FB07M8KBTX8%2Fref%3Dsr_1_70_sspa%3Fkeywords%3Dguitar%26qid%3D1652621843%26sr%3D8-70-spons%26psc%3D1&qualifier=1652621843&id=7569169609036959&widgetName=sp_mtf
267,Blueberry,"B-G41S, 41 Inch Acoustic Guitar Kit, with Bag,Belt, One Pack Strings And Picks (Natural)","₹6,500",7 Days Replacement,"FREE delivery: Thursday, May 19 Details",In Stock,https://www.amazon.in/gp/slredirect/picassoRedirect.html/ref=pa_sp_mtf_aps_sr_pg2_1?ie=UTF8&adId=A00502093JZAPX140CZG0&url=%2FBlueberry-B-G41S-Acoustic-Strings-Natural%2Fdp%2FB07PKQGF2N%2Fref%3Dsr_1_71_sspa%3Fkeywords%3Dguitar%26qid%3D1652621843%26sr%3D8-71-spons%26psc%3D1&qualifier=1652621843&id=7569169609036959&widgetName=sp_mtf
268,Blueberry,"B-40, 40"" Acoustic Guitar Kit with Bag,Belt, One Pack Strings & Picks (Sunburst)","₹3,695",7 Days Replacement,"FREE delivery: Thursday, May 19 Details",In Stock,https://www.amazon.in/gp/slredirect/picassoRedirect.html/ref=pa_sp_mtf_aps_sr_pg2_1?ie=UTF8&adId=A00497171W5X8ZPSW04BM&url=%2FBlueberry-Acoustic-Guitar-Strings-Sunburst%2Fdp%2FB08L7XJQQ1%2Fref%3Dsr_1_72_sspa%3Fkeywords%3Dguitar%26qid%3D1652621843%26sr%3D8-72-spons%26psc%3D1&qualifier=1652621843&id=7569169609036959&widgetName=sp_mtf
269,JUAREZ,"Fiésta 41 Inch Acoustic Guitar Cutaway with Dual Action Truss Rod, 21 Frets Rosewood Fretboard & Bridge, Padded 5mm Cotton Bag, Cotton Strap, 2 Picks, Allen Key, Extra String Set, 3TS Sunburst","₹4,211",7 Days Replacement,"FREE delivery: Thursday, May 19 Details",In Stock,https://www.amazon.in/JUAREZ-Acoustic-Rosewood-Fretboard-3TS/dp/B08GZXNSBG/ref=sr_1_73?keywords=guitar&qid=1652621843&sr=8-73
270,Yamaha,"PACIFICA012 Electric Guitar, Red Metallic","₹13,900",7 Days Replacement,"FREE delivery: Saturday, May 21 Details",In Stock,https://www.amazon.in/Yamaha-PAC012-Electric-Guitar-Metallic/dp/B000MLY7XS/ref=sr_1_74?keywords=guitar&qid=1652621843&sr=8-74
271,Ketostics™,"Venus Special Cutaway Rosewood 41 Inch Givson Acoustic Guitar Kit with Bag, Rhythm String Set, Strap and 5 Plectrums, (sunburst)","₹3,799",7 Days Replacement,"FREE delivery: Thursday, May 19 Details",In Stock,https://www.amazon.in/Ketostics-Special-Sunburst-Acoustic-Plectrums/dp/B08JCJS3H6/ref=sr_1_75?keywords=guitar&qid=1652621843&sr=8-75
272,Ibanez,"MD39C-NT Acoustic Guitar (Natural), Designed in Japan and Made Specially for India","₹6,999",7 Days Replacement,"FREE delivery: Saturday, May 21 Details",In Stock,https://www.amazon.in/Ibanez-IBA-MD39CNT-Acoustic-Guitar-MD39C-NT/dp/B07G4CCMYL/ref=sr_1_76?keywords=guitar&qid=1652621843&sr=8-76
273,Kadence,"Frontier Jumbo Semi Acoustic Guitar With Die Cast Keys,Super Combo (Bag, 1 pack Strings, Strap, Picks, Capo, Tuner)","₹7,349.00",7 Days Replacement,"FREE delivery: Friday, May 20 Details",In Stock,https://www.amazon.in/Kadence-Frontier-Acoustic-Guitar-Equalizer/dp/B01HRIHJWY/ref=sr_1_77?keywords=guitar&qid=1652621843&sr=8-77
274,Blueberry,"D38 TrussRod Acoustic Guitar Kit with Bag, String,Belt & Picks (Sunburst)","₹2,895",7 Days Replacement,"FREE delivery: Thursday, May 19 Details",In Stock,https://www.amazon.in/Blueberry-Trussrod-Acoustic-Guitar-Sunburst/dp/B08WH5553T/ref=sr_1_78?keywords=guitar&qid=1652621843&sr=8-78
275,Blueberry,"B-D38, 38 Inch Acoustic Guitar Kit Inbuilt Truss Rod with Bag, Strap, One Pack Strings And Picks (Sunburst)","₹2,795",7 Days Replacement,"FREE delivery: Thursday, May 19 Details",In Stock,https://www.amazon.in/Blueberry-B-D38-Acoustic-Inbuilt-Sunburst/dp/B08LNP8KGS/ref=sr_1_79?keywords=guitar&qid=1652621843&sr=8-79
276,JUAREZ,"Arpeggio 39 Inch Acoustic Guitar Kit, Spruce Top, Rosewood Fretboard & Bridge, Truss Rod, Chrome Die Cast Machine Tuners, Sunburst","₹6,315",7 Days Replacement,"FREE delivery: Saturday, May 21 Details",In Stock,https://www.amazon.in/JUAREZ-Arpeggio-Acoustic-Rosewood-Fretboard/dp/B08LBHN8ZR/ref=sr_1_80?keywords=guitar&qid=1652621843&sr=8-80
277,Givson,Oxford Natural 6 String Right Hand Acoustic Semi Electric Guitar Special Quality Rosewood Fretboard With Free Bag and 1 Set String and 2 Picks,"₹4,249",7 Days Replacement,"FREE delivery: Saturday, May 21 Details",In Stock,https://www.amazon.in/Natural-Acoustic-Electric-Rosewood-Fretboard/dp/B09R2G69BV/ref=sr_1_81?keywords=guitar&qid=1652621843&sr=8-81
278,Kordz,"Luana Black Matt Rosewood Fretboard Acoustic Guitar With Bag,Strap,1 Set of Extra Strings and 2 Picks","₹3,600",7 Days Replacement,"FREE delivery: Friday, May 20 Details",In Stock,https://www.amazon.in/Kordz-Rosewood-Fretboard-Acoustic-Strings/dp/B09S13CW14/ref=sr_1_82?keywords=guitar&qid=1652621843&sr=8-82
279,Ibanez,"Acoustic Guitar MD39C Right Handed Cutaway Guitar - Natural With Bag, Belt, Plectrums Complete Pack.","₹8,999",7 Days Replacement,"FREE delivery: Saturday, May 21 Details",In Stock,https://www.amazon.in/Ibanez-Acoustic-Guitar-Handed-Cutaway/dp/B08FMW6WJM/ref=sr_1_83?keywords=guitar&qid=1652621843&sr=8-83
280,Givson,"Venus Special Cutaway Rosewood 41 Inch Acoustic Guitar Kit with Bag, Rhythm String Set, Strap and 5 Plectrums, (red)","₹3,999",7 Days Replacement,"FREE delivery: Thursday, May 19 Details",In Stock,https://www.amazon.in/Special-Cutaway-Rosewood-Acoustic-Plectrums/dp/B09P41Y4HZ/ref=sr_1_84?keywords=guitar&qid=1652621843&sr=8-84
281,Yamaha,"F280 Acoustic Guitar, Tobacco Brown Sunburst with Bajaao Gig bag","₹8,299",7 Days Replacement,"FREE delivery: Saturday, May 21 Details",In Stock,https://www.amazon.in/Yamaha-Acoustic-Tobacco-Sunburst-Bajaao/dp/B09PBDGD82/ref=sr_1_85?keywords=guitar&qid=1652621843&sr=8-85
282,Juârez,"Acoustic Guitar, 38 Inch Cutaway, JRZ38CT, Hippie Funky Design, with Bag, Picks, Strap & Extra String set","₹7,990",7 Days Replacement,"FREE delivery: Saturday, May 21 Details",In Stock,https://www.amazon.in/Juarez-Acoustic-Guitar-Cutaway-JRZ38CT/dp/B01N3TTYJQ/ref=sr_1_86?keywords=guitar&qid=1652621843&sr=8-86
283,Kadence,"Professional Kids Guitar 5-10 Years Natural with Bag, Strap, Strings and Picks","₹3,799",7 Days Replacement,"FREE delivery: Saturday, May 21 Details",In Stock,https://www.amazon.in/Kadence-Professional-Guitar-Natural-Strings/dp/B094ZWXHV4/ref=sr_1_87?keywords=guitar&qid=1652621843&sr=8-87
284,Kadence,"Frontier 34inch guitar for Kids, Travel Guitar for Adult Acoustic Guitar with Die Cast Keys, Set of Strings, Strap, Picks and Bag (Black Guitar)","₹3,499",7 Days Replacement,"FREE delivery: Saturday, May 21 Details",In Stock,https://www.amazon.in/Kadence-Professional-Guitar-Years-Strings/dp/B07YZK5B2Z/ref=sr_1_88?keywords=guitar&qid=1652621843&sr=8-88
285,Kadence,"39” Classical Guitar Nylon Strings Acoustic Guitar with Truss Rod for Beginner Professional With Bag (30"" 1/4 Semi Acoustic GLE03)","₹3,999.00",7 Days Replacement,"FREE delivery: Saturday, May 21 Details",In Stock,https://www.amazon.in/Kadence-Classical-Acoustic-Beginner-Professional/dp/B09V2R4CQT/ref=sr_1_89?keywords=guitar&qid=1652621843&sr=8-89
286,Kadence,"Frontier Series Acoustic Guitar With Equalizer and Pickup,Die Cast Keys Sunburst","₹5,799",7 Days Replacement,"FREE delivery: Saturday, May 21 Details",In Stock,https://www.amazon.in/Kadence-Frontier-Acoustic-Equlizer-Sunburst/dp/B07DQNS5XR/ref=sr_1_90?keywords=guitar&qid=1652621843&sr=8-90
287,Intern,INT-38C Natural Acoustic Guitar kit with carry bag & picks,"₹2,090",7 Days Replacement,"FREE delivery: Saturday, May 21 Details",In Stock,https://www.amazon.in/Intern-INT-38C-Natural-Acoustic-Guitar/dp/B07X4LPJ6H/ref=sr_1_91?keywords=guitar&qid=1652621843&sr=8-91
288,RockJam,RJEG02-SK-BB Electric Guitar Starter Kit (Blue Burst),"₹8,630",7 Days Replacement,"FREE delivery: Saturday, May 21 Details",In Stock,https://www.amazon.in/RockJam-RJEG02-SK-BB-Electric-Guitar-Starter/dp/B0747TD557/ref=sr_1_92?keywords=guitar&qid=1652621843&sr=8-92
289,GIVSON,"Ketostics Venus Special Guitar (black) with bag, string set, belt and 5 picks","₹4,199",7 Days Replacement,"FREE delivery: Thursday, May 19 Details",In Stock,https://www.amazon.in/Givson-Special-Guitar-VS-BLK-Acoustic/dp/B07SZ5KR61/ref=sr_1_93?keywords=guitar&qid=1652621843&sr=8-93
290,Kadence,"AstroMan Electric Guitar, 21 FRETS, ROSEWOOD FRETBOARD, H - S - S PICK UPS Sun brust combo with Bag, Guitar strap,guitar cable and Picks with Amplifier","₹8,999.00",7 Days Replacement,FREE delivery: May 17 - 21 Details,In Stock,https://www.amazon.in/Kadence-AstroMan-Electric-ROSEWOOD-FRETBOARD/dp/B09YHPS66K/ref=sr_1_94?keywords=guitar&qid=1652621843&sr=8-94
291,INTERN,"40 inches Acoustic Guitar with Pick-up & truss rod, carry bag, strings pack, strap & picks. Premium Wooden durable built, Best tonal stability with professional sound amplificaiton. (White).","₹8,995",7 Days Replacement,"FREE delivery: Saturday, May 21 Details",In Stock,https://www.amazon.in/Acoustic-Pick-up-stability-professional-amplificaiton/dp/B09YH7WJP3/ref=sr_1_95?keywords=guitar&qid=1652621843&sr=8-95
292,Fender,CD 60 Dread V3 DS 6 String Acoustic Guitar - Walnut Fretboard-Black,"₹12,600",7 Days Replacement,"FREE delivery: Sunday, May 22 Details",In Stock,https://www.amazon.in/Fender-Dread-String-Acoustic-Guitar/dp/B07RM4B5LJ/ref=sr_1_96?keywords=guitar&qid=1652621843&sr=8-96
293,Medellin,MED-BLU-C Linden Wood Acoustic Guitar,"₹2,599",7 Days Replacement,"FREE delivery: Saturday, May 21 Details",In Stock,https://www.amazon.in/Jixing-Strings-Acoustic-Guitars-Black/dp/B00V5ZCVQA/ref=sr_1_97?keywords=guitar&qid=1652621843&sr=8-97
294,Yamaha,FSX80C Semi Acoustic Cutaway Guitar with Bag (Natural),"₹12,980",7 Days Replacement,FREE delivery: May 17 - 19 Details,In Stock,https://www.amazon.in/Yamaha-FSX80C-Acoustic-Cutaway-Natural/dp/B09HL3GFZF/ref=sr_1_98?keywords=guitar&qid=1652621843&sr=8-98
295,Juârez,"Acoustic Guitar, 38 Inch Cutaway, JRZ38C with Bag, Strings, Pick and Strap, Red","₹2,649",7 Days Replacement,"FREE delivery: Saturday, May 21 Details",In Stock,https://www.amazon.in/JUAREZ-JRZ38C-Handed-Acoustic-Strings/dp/B01FYYTDW2/ref=sr_1_99?keywords=guitar&qid=1652621843&sr=8-99
296,Yamaha,FX280 Semi acoustic Dreadnought Guitar with Bag (Natural),"₹11,300",7 Days Replacement,"FREE delivery: Sunday, May 22 Details",In Stock,https://www.amazon.in/Yamaha-FX280-acoustic-Dreadnought-Natural/dp/B09HR6BNFQ/ref=sr_1_100?keywords=guitar&qid=1652621843&sr=8-100
297,Kadence,"A311, 36"" 6-strings Acoustic Guitar with bag","₹5,248",7 Days Replacement,"FREE delivery: Saturday, May 21 Details",In Stock,https://www.amazon.in/Kadence-A311-6-strings-Acoustic-Guitar/dp/B09BN1MN2T/ref=sr_1_101?keywords=guitar&qid=1652621843&sr=8-101
298,Kadence,"Guitar Frontier Series, Blue Acoustic Guitar with Die Cast Keys, Set of Strings, Strap, Picks, Guitar stand, Capo and Bag, Super Combo (Blue, Acoustic)","₹5,499.00",7 Days Replacement,"FREE delivery: Friday, May 20 Details",In Stock,https://www.amazon.in/Kadence-Frontier-Acoustic-Foldable-Strings/dp/B01CJJGEVS/ref=sr_1_102?keywords=guitar&qid=1652621843&sr=8-102
299,Yamaha,"Electric-Acoustic Guitar FSX80C Dreadnought With With Mexa Sponge Bag, Guitar Belt, Guitar Stand, String Set & Plectrums.(NT)","₹13,539",7 Days Replacement,"FREE delivery: Saturday, May 21 Details",In Stock,https://www.amazon.in/Yamaha-Electric-Acoustic-FSX80C-Dreadnought-Plectrums/dp/B09HSJ6GPQ/ref=sr_1_103?keywords=guitar&qid=1652621843&sr=8-103
300,Kadence,"39” Classical Guitar Nylon Strings Acoustic Guitar with Truss Rod for Beginner Professional With Bag (30"" 1/4 Semi Acoustic Gl101R)","₹6,999.00",7 Days Replacement,"FREE delivery: Saturday, May 21 Details",In Stock,https://www.amazon.in/Kadence-Classical-Acoustic-Beginner-Professional/dp/B09V2SPSDX/ref=sr_1_104?keywords=guitar&qid=1652621843&sr=8-104
301,Blueberry,"B40-40Inches Acoustic Guitar Kit inbuilt Truss Rod, with Bag, Strap, One Pack Strings and Picks (Sunburst)","₹4,295",7 Days Replacement,"FREE delivery: Thursday, May 19 Details",In Stock,https://www.amazon.in/gp/slredirect/picassoRedirect.html/ref=pa_sp_atf_next_aps_sr_pg3_1?ie=UTF8&adId=A00505533US57S2BBM7O7&url=%2FBlueberry-40Inches-Acoustic-inbuilt-Sunburst%2Fdp%2FB07PHFXH6W%2Fref%3Dsr_1_97_sspa%3Fkeywords%3Dguitar%26qid%3D1652622302%26sr%3D8-97-spons%26psc%3D1&qualifier=1652622302&id=5800655970879729&widgetName=sp_atf_next
302,GUITAR,"BRO - COMBO (Blue Acoustic Guitar for Beginner, Guitar Learning Kit, Song Book, Video Lectures, Accessories like Pick, Bag)","₹6,499",7 Days Replacement,FREE delivery: May 20 - 24,In Stock,https://www.amazon.in/gp/slredirect/picassoRedirect.html/ref=pa_sp_atf_next_aps_sr_pg3_1?ie=UTF8&adId=A08791823J4GRMJMKDFMU&url=%2FGUITAR-BRO-Acoustic-Beginner-Accessories%2Fdp%2FB07TC7TWCR%2Fref%3Dsr_1_98_sspa%3Fkeywords%3Dguitar%26qid%3D1652622302%26sr%3D8-98-spons%26psc%3D1&qualifier=1652622302&id=5800655970879729&widgetName=sp_atf_next
303,Blueberry,"B-D38, 38 Inch Acoustic Guitar Kit Inbuilt Truss Rod with Bag, Strap, One Pack Strings And Picks (Sunburst)","₹2,795",7 Days Replacement,"FREE delivery: Thursday, May 19 Details",In Stock,https://www.amazon.in/gp/slredirect/picassoRedirect.html/ref=pa_sp_atf_next_aps_sr_pg3_1?ie=UTF8&adId=A00571736LVE00ONYVW0&url=%2FBlueberry-B-D38-Acoustic-Inbuilt-Sunburst%2Fdp%2FB08LNP8KGS%2Fref%3Dsr_1_99_sspa%3Fkeywords%3Dguitar%26qid%3D1652622302%26sr%3D8-99-spons%26psc%3D1&qualifier=1652622302&id=5800655970879729&widgetName=sp_atf_next
304,Kadence,"39” Classical Guitar Nylon Strings Acoustic Guitar with Truss Rod for Beginner Professional With Bag (30"" 1/4 Semi Acoustic Gl101R)","₹6,999.00",7 Days Replacement,"FREE delivery: Saturday, May 21 Details",In Stock,https://www.amazon.in/Kadence-Classical-Acoustic-Beginner-Professional/dp/B09V2SPSDX/ref=sr_1_100?keywords=guitar&qid=1652622302&sr=8-100
305,Fender,FA-125 Dreadnought Acoustic Guitar,"₹12,002.00",7 Days Replacement,"FREE delivery: Friday, May 20 Details",In Stock,https://www.amazon.in/Fender-Alternative-String-Acoustic-971210521/dp/B07LD8RZVR/ref=sr_1_101?keywords=guitar&qid=1652622302&sr=8-101
306,INTERN,"Cutaway Design Acoustic Guitar Pack -Humidity Proof, Bend resistance, Durable Action, Natural tone & bright resonance. Red Carbon Fibre/Fiber Guitar with Bag, Strap, Strings set & Plectrums.","₹2,589",7 Days Replacement,"FREE delivery: Saturday, May 21 Details",In Stock,https://www.amazon.in/Acoustic-Humidity-resistance-resonance-Plectrums/dp/B09RR1SG7X/ref=sr_1_102?keywords=guitar&qid=1652622302&sr=8-102
307,Tanglewood,"Crossroads TWCR SFCE Semi Acoustic Guitar, 6 Strings, Super Folk Cutaway, Whiskey Barrel Burst Satin Finish","₹17,199",7 Days Replacement,"FREE delivery: Wednesday, May 18 Details",In Stock,https://www.amazon.in/Tanglewood-Crossroads-TWCR-SFCE-Acoustic/dp/B01M7R9JOT/ref=sr_1_103?keywords=guitar&qid=1652622302&sr=8-103
308,Intern,"INT-38C-RD-G Cutaway Right Handed Acoustic Guitar Kit, With Bag, Strings, Pick And Strap (Red, 6 Strings)","₹2,690",7 Days Replacement,"FREE delivery: Saturday, May 21 Details",In Stock,https://www.amazon.in/Intern-INT-38C-RD-G-Guitar-Kit-Red/dp/B07K959RKX/ref=sr_1_104?keywords=guitar&qid=1652622302&sr=8-104
309,Festra,"38C, 38 Inch Acoustic Guitar Kit with Bag, Strap, One Pack Strings And 2 Picks (Black)","₹2,695",7 Days Replacement,"FREE delivery: Thursday, May 19 Details",In Stock,https://www.amazon.in/Festra-Acoustic-Guitar-Strap-Strings/dp/B09JTR6N53/ref=sr_1_105?keywords=guitar&qid=1652622302&sr=8-105
310,Yamaha,"Electric-Acoustic Guitar FX280 Dreadnought With Mexa Sponge Guitar Bag, Belt,Plectrums & String Set.(Natural)","₹12,189",7 Days Replacement,"FREE delivery: Saturday, May 21 Details",In Stock,https://www.amazon.in/Electric-Acoustic-FX280-Dreadnought-Plectrums-Natural/dp/B09HSDVQDT/ref=sr_1_106?keywords=guitar&qid=1652622302&sr=8-106
311,Vault,EA40-CE 41 inch Premium Spruce-Top Cutaway Electro Acoustic Guitar (Natural),"₹8,549",7 Days Replacement,"FREE delivery: Friday, May 20 Details",In Stock,https://www.amazon.in/EA40-CE-Premium-Spruce-Top-Cutaway-Acoustic/dp/B08WHV1NN8/ref=sr_1_107?keywords=guitar&qid=1652622302&sr=8-107
312,Fender,Squier Bulletstrathssawt Stratocaster Electric Guitar,"₹13,489",7 Days Replacement,"FREE delivery: Saturday, May 21 Details",In Stock,https://www.amazon.in/Fender-Squier-Bulletstrathssawt-Stratocaster-Electric/dp/B0171NPNYQ/ref=sr_1_108?keywords=guitar&qid=1652622302&sr=8-108
313,Kadence,Astro Man Electric Guitar,"₹7,499.00",7 Days Replacement,"FREE delivery: Saturday, May 21 Details",In Stock,https://www.amazon.in/Kadence-Astro-Man-Electric-Guitar/dp/B07GNL3G5Z/ref=sr_1_109?keywords=guitar&qid=1652622302&sr=8-109
314,TOXOT,"TOYS 38 IN Right Handed Acoustic Guitar With Carry Bag & Picks | Musical Instrument Learning Toy for Kids | Humidity Proof, Bend resistance, Durable Action, Natural Tone & Bright Resonance","₹1,499",7 Days Replacement,"FREE delivery: Saturday, May 21 Details",In Stock,https://www.amazon.in/TOXOT-TOYS-Instrument-resistance-Resonance/dp/B09Z6LKP5K/ref=sr_1_110?keywords=guitar&qid=1652622302&sr=8-110
315,Intern,"INT-38C-NT-G Right Handed Acoustic Guitar Kit, With Bag, Strings, Pick And Strap (Natural, 6-Strings)","₹2,690",7 Days Replacement,"FREE delivery: Saturday, May 21 Details",In Stock,https://www.amazon.in/Intern-INT-38C-NT-G-Guitar-Kit-Natural/dp/B07K9MZZH9/ref=sr_1_111?keywords=guitar&qid=1652622302&sr=8-111
316,Blueberry,"B-40, 40"" Acoustic Guitar Kit with Bag,Belt, One Pack Strings & Picks (Sunburst)","₹3,695",7 Days Replacement,"FREE delivery: Thursday, May 19 Details",In Stock,https://www.amazon.in/Blueberry-Acoustic-Guitar-Strings-Sunburst/dp/B08L7XJQQ1/ref=sr_1_112?keywords=guitar&qid=1652622302&sr=8-112
317,JUAREZ,"Arpeggio 99.06 cm (39 Inch) Acoustic Guitar Kit, Spruce Top, Rosewood Fretboard & Bridge, Truss Rod, Chrome Die Cast Machine Tuners, Black","₹6,173",7 Days Replacement,"FREE delivery: Saturday, May 21 Details",In Stock,https://www.amazon.in/JUAREZ-Arpeggio-Acoustic-Rosewood-Fretboard/dp/B08LBHB547/ref=sr_1_113?keywords=guitar&qid=1652622302&sr=8-113
318,Hovner,"215 Green F-Cut Rosewood Fretboard Acoustic Guitar With Bag,Strap,1 Set of Extra Strings and 2 Picks V2","₹4,280",7 Days Replacement,"FREE delivery: Saturday, May 21 Details",In Stock,https://www.amazon.in/215-Rosewood-Fretboard-Acoustic-Strings/dp/B08VHC4BSW/ref=sr_1_114?keywords=guitar&qid=1652622302&sr=8-114
319,Pluto,HW39C - 201- SB 6 String Acoustic Guitar,"₹6,204",7 Days Replacement,"FREE delivery: Sunday, May 22 Details",In Stock,https://www.amazon.in/Pluto-HW39C-String-Acoustic-Guitar/dp/B01IPAPZ06/ref=sr_1_115?keywords=guitar&qid=1652622302&sr=8-115
320,JUAREZ,"Arpeggio 39 Inch Acoustic Guitar Kit, Spruce Top, Rosewood Fretboard & Bridge, Truss Rod, Chrome Die Cast Machine Tuners, Red","₹5,930",7 Days Replacement,"FREE delivery: Thursday, May 19 Details",In Stock,https://www.amazon.in/JUAREZ-Arpeggio-Acoustic-Rosewood-Fretboard/dp/B08LBJ8PTM/ref=sr_1_116?keywords=guitar&qid=1652622302&sr=8-116
321,Vault,ST1 Strat Style 6 String Electric Guitar- Black,"₹7,599",7 Days Replacement,"FREE delivery: Sunday, May 22 Details",In Stock,https://www.amazon.in/Vault-Strat-String-Electric-Guitar/dp/B08F2BJC5W/ref=sr_1_117?keywords=guitar&qid=1652622302&sr=8-117
322,Juârez,"JRZ38C/MAH 6 Strings Acoustic Guitar 38 Inch Cutaway, Right Handed, Mahogany with Bag, Strings, Picks and Strap","₹2,799",7 Days Replacement,"FREE delivery: Saturday, May 21 Details",In Stock,https://www.amazon.in/JRZ38C-Strings-Acoustic-Cutaway-Mahogany/dp/B071JM8C6T/ref=sr_1_118?keywords=guitar&qid=1652622302&sr=8-118
323,Juarez,"JRZ-ST02 6-String Electric Guitar, Right Handed, Red, with Case/Bag and Picks","₹6,082",7 Days Replacement,"FREE delivery: Saturday, May 21 Details",In Stock,https://www.amazon.in/Juarez-JRZ-ST01-6-String-Electric-Without/dp/B01FYZSOHG/ref=sr_1_119?keywords=guitar&qid=1652622302&sr=8-119
324,Givson,"Venus Special Cutaway Rosewood 41 Inch Acoustic Guitar Kit with Bag, Rhythm String Set, Strap and 5 Plectrums, (blue)","₹3,999",7 Days Replacement,"FREE delivery: Thursday, May 19 Details",In Stock,https://www.amazon.in/Special-Cutaway-Rosewood-Acoustic-Plectrums/dp/B09P3YQQLK/ref=sr_1_120?keywords=guitar&qid=1652622302&sr=8-120
325,Fender,"SA105CE Electric Acoustic Guitar Dreadnought With Bag, Belt & Plectrums Combo Pack (SB)","₹12,999",7 Days Replacement,"FREE delivery: Saturday, May 21 Details",In Stock,https://www.amazon.in/Fender-Electric-Acoustic-Dreadnought-Plectrums/dp/B08CTGTV96/ref=sr_1_121?keywords=guitar&qid=1652622302&sr=8-121
326,Yamaha,"C40M Classical Guitar, Mahagony","₹7,250",7 Days Replacement,"FREE delivery: Saturday, May 21 Details",In Stock,https://www.amazon.in/Yamaha-C40MII-Acoustic-Concert-Guitar/dp/B005LG2JRK/ref=sr_1_122?keywords=guitar&qid=1652622302&sr=8-122
327,Givson,Cambridge CB-WR 6-String Cutaway Right Hand Electro-Acoustic Guitar with Bag (Wine Red),"₹7,200",7 Days Replacement,FREE delivery: May 19 - 21 Details,In Stock,https://www.amazon.in/Givson-Cambridge-CB-WR-6-String-Electro-Acoustic/dp/B01D9OK81O/ref=sr_1_124?keywords=guitar&qid=1652622302&sr=8-124
328,Hovner,"215 Royal Metallic Black F-Cut Rosewood Fretboard Acoustic Guitar With Bag,Strap,1 Set of Extra Strings and 2 Picks","₹4,280",7 Days Replacement,"FREE delivery: Saturday, May 21 Details",In Stock,https://www.amazon.in/Hovner-Royal-Metallic-Rosewood-Fretboard/dp/B09VQ1YYF8/ref=sr_1_125?keywords=guitar&qid=1652622302&sr=8-125
329,Hovner,"Venus Sunburst 6-String Cut-A-Way Right Hand Acoustic Semi-Electric Guitar with bag and free 1 Set String, 2 Picks.","₹4,049",7 Days Replacement,"FREE delivery: Friday, May 20 Details",In Stock,https://www.amazon.in/Hovner-Sunburst-6-String-Acoustic-Semi-Electric/dp/B08S3WBXPC/ref=sr_1_126?keywords=guitar&qid=1652622302&sr=8-126
330,Epiphone,"Les Paul Express""Travel-Size"" Electric Guitar","₹14,900",7 Days Replacement,"FREE delivery: Saturday, May 21 Details",In Stock,https://www.amazon.in/Epiphone-Express-Travel-Size-Electric-Guitar/dp/B00I056PII/ref=sr_1_127?keywords=guitar&qid=1652622302&sr=8-127
331,Mini,"Pocket Guitar Practice, Durable 6 Fret Portable Pocket Guitar Practice Strings Tool, for Guitar Beginner Hands Training","₹1,711",7 Days Replacement,FREE delivery: June 3 - 10 Details,In Stock,https://www.amazon.in/Practice-Durable-Portable-Beginner-Training/dp/B09V1L8YWY/ref=sr_1_128?keywords=guitar&qid=1652622302&sr=8-128
332,JP,Mfg 4 String Acoustic Guitar Musical Instrument Educational Small Guitar for Beginners Kids Children,₹999,7 Days Replacement,"FREE delivery: Saturday, May 21 Details",In Stock,https://www.amazon.in/Acoustic-Instrument-Educational-Beginners-Children/dp/B09HNWHN2L/ref=sr_1_129?keywords=guitar&qid=1652622302&sr=8-129
333,Givson,"Venus Special Cutaway Rosewood 41 Inch Acoustic Guitar Kit with Bag, Rhythm String Set, Strap and 5 Plectrums, (blue)","₹3,999",7 Days Replacement,"FREE delivery: Thursday, May 19 Details",In Stock,https://www.amazon.in/Special-Cutaway-Rosewood-Acoustic-Plectrums/dp/B09P41RQSQ/ref=sr_1_131?keywords=guitar&qid=1652622302&sr=8-131
334,Givson,"Venus Special Cutaway Rosewood 41 Inch Acoustic Guitar Kit with Bag, Rhythm String Set, Strap and 5 Plectrums, (BLACK)","₹4,199",7 Days Replacement,"FREE delivery: Thursday, May 19 Details",In Stock,https://www.amazon.in/Special-Cutaway-Rosewood-Acoustic-Plectrums/dp/B09P3YBN48/ref=sr_1_132?keywords=guitar&qid=1652622302&sr=8-132
335,Yamaha,"Electric-Acoustic Guitar FX280 Dreadnought With Mexa Sponge Guitar Bag, Belt,Plectrums & String Set.","₹12,580",7 Days Replacement,"FREE delivery: Saturday, May 21 Details",In Stock,https://www.amazon.in/Yamaha-Electric-Acoustic-FX280-Dreadnought-Plectrums/dp/B09HSHNR6R/ref=sr_1_133?keywords=guitar&qid=1652622302&sr=8-133
